"Field name","Description","Field Type","Data Type","Examples"
"Experiment_ID","The experiment ID – the syntax to be decided by WP5. Can be extrapolated from the the MethodNameID. Used for internal reference.","Recommended","String",NA
"CellType","Describe as per the following resources: atlases/Pan_Immune_CellTypist/v2/encyclopedia/encyclopedia_table.xlsx of the CellTypist<br><br>HuBMAP Common Coordinate Framework (CCF) ASCT+B tables<br><br>Cell Ontology.","Recommended","Text, url","Granulocytes, epithelial"
"CellTypeOntologyID","Cell Ontology (CL) term.(http://www.ebi.ac.uk/ols4/ontologies/cl).","Recommended","Text","CL: 0010006"
"CellLine","A cell line is defined as a genetically stable and homogenous population of cultured cells that shares a common propagation history (i.e. has been successively passaged together in culture). Ref: Sarntivijai, Sirarat, et al. 2014. “CLO: The Cell Line Ontology.” Journal of Biomedical Semantics 5(1):37. doi: 10.1186/2041-1480-5-37.","Mandatory","Text, URL","HepG2, A549, hiPS - Human induced-pluripotent stem cells, 293FT,Human embryonic stem cell (hESC)"
"CellLineOntologyID","Cell Line Ontology<br><br>Ref: https://www.ebi.ac.uk/ols4/ontologies/clo","Recommended","Text","CLO:0050126 for RCB0027 cell which is an immortal human cell line cell that has the characteristics: Chronic myelogenous leukemia, sensitive to NK cell. Differentiate to erythroid cells"
"CellLineGroup","The replication capability of the cell line","Optional","Text","finite, continuous, immortalized, stem cell lines"
"CellProvider","Name of the company or lab or repository providing the cells","Mandatory","Text","Invitrogen, ThermoFisher, ECACC"
"CellCatalogueNumber","The unique identifier of a cell line (e.g., ATCC, ECACC, DMSZ, UKSCB designations).","Recommended","String","84101003, HB-8065, R70007,  PCS-450-012"
"CellBatchNumber","Provide the batch number of the cells procured.","Mandatory","String",NA
"CellLineDesignation","The identification provided when the test systems is sourced from recognised cell culture banks (e.g. ATCC, ECACC, DMSZ, UKSCB. Cell lines can have different designation when cultured in house and not procured from external cell culture bank.","Mandatory","Text","HeLa, CCL-2,Hep G2 [HEPG2]"
"CellLlineDesignationRRID","Research Resource ID (RRID) from Cellosaurus (https://www.cellosaurus.org/index.html)","Optional","String","RRID:CVCL_0030,RRID:CVCL_0027"
"CultureMediumComposition","Describe the cell culture medium composition briefly with key components, such as serum type and percentage, antibiotics.","Mandatory","Text","Roswell Park Memorial Institute Medium (RPMI 1640) supplemented with 10 % (v/v) Fetal Bovine Serum (FBS) heat-inactivated, 100 U/mL penicillin, 100 μg/mL streptomycin, and 4 mM/L glutamine"
"CellMediumSupplierCatalogueNumber","Name of the company from which medium was procured along with catalogue number","Recommended","Text","ThermoFisher (11965 - DMEM, high glucose)"
"SerumPercentage","Percentage of serum used in the cell culture media, if used. Avoid adding percentage symbol after reporting the data.","Conditionally required","Numeric",NA
"SerumCatalogueNumber","Catalogue number of the serum procured","Recommended","String; weblink","A5256701; https://www.thermofisher.com/order/catalog/product/A5256701"
"SerumSource","Serum supplier","Recommended","Text","ThermoFisher Scientific"
"SerumLotNumber","Provide the lot/control number for the serum","Recommended","String",NA
"HeatInactivation","Mention in only “no or yes” as a response whether serum was subjected to heat","Mandatory","Text",NA
"MediumAdditive1","Mention the additives to the cell culture medium.","Recommended","String",NA
"MediumAdditive1_supplier","Provide the name of the supplier providing the additive and catalogue number associated with it.","Recommended","String",NA
"MediumAdditive1_ concentration","Provide the concentration of the additive used in the experiment, preferably in molar concentrations.","Recommended","Numeric",NA
"MediumAdditive1_concentrationUnit","The measurement unit used to express the concentration or amount of the additive","Recommended","Text",NA
"OtherMaterialsAdded1","Other materials (e.g. antibiotics) added to the cell culture media","Optional","Text",NA
"OtherMaterialsAdded1Concentration","Provide the concentration of the material added in the experiment, preferably in molar concentrations","Optional","Numeric",NA
"OtherMaterialsAdded1Unit","The measurement unit used to express the concentration or amount of the added material","Optional","Text",NA
"MicrowellPlateFormat","Number of wells in the microwell plate used for the exposure experiment","Mandatory","Integer","48, 96, 384 or 1536"
"MicrowellPlateDesign","Details of the microwell plate design (i.e. describe colour and shape of microwell plates).","Mandatory","Text","transparent, black, white, flat, round bottom"
"PlateManufacturer","Name of the plate manufacturer","Recommended","Text",NA
"PlateProductNumber","The product number provided by the supplier for the microwell plate used in the experiment","Recommended","String",NA
"VolumeOfIncubationMediumWell","Amount of liquid growth media in each well","Mandatory","Numeric",NA
"VolumeOfIncubationMediumWellUnit","The measurement unit via which volume of media in each microwell is expressed.","Mandatory","Text",NA
"CellPassageNumber","The term “passage” refers to the transfer of cells from one culture vessel to another or a number of vessels, usually with the aim of increasing cell numbers (ref: Pamies et.al., 2022)<br><br>Passage number refers to the number of times the cell line has been re-plated (adherent cultures) or re-seeded (suspension cultures) since it was first established or thawed from a frozen stock.","Recommended","Integer",NA
"SeedingDensity","Number of cells placed on a growth material per unit area.","Recommended","Integer",NA
"SeedingDensityUnit","The measurement unit via which seeding density is expressed","Recommended","Text",NA
"CellCultureTechnique","Describe how the cells were cultured in the medium. (or just give cell growth mode – adherent/suspension)","Recommended","Text","2D- Adherent (petri dish or flask) 3D-Suspension cultures on non-adherent plates, 3D-Cultures in concentrated medium or in gel-like substances, 3D-Cultures on scaffold, 2D-suspension, air-liquid interface, in transwell inserts etc."
"CellPretreatment","Were the cells exposed to any specific substances before exposure with the test substance? Respond in “yes” and “no”","Mandatory","Text",NA
"PretreatmentReasons","Describe why was pre-treatment done.","Conditionally required","Text","To remove antibiotics"
"PretreatmentCompound","Full name of the chemical compound(s) used in pre-treatment","Conditionally required","Text","phorbol 12-myristate-13-acetate "
"DilutionType","The dilution technique followed in the experiment","Recommended","Text","Direct, Serial, Logarithmic"
"DilutionSteps","Provide information on the dilution steps from ‘stock solution’ including the final % of vehicle/solvent in the exposure medium","Recommended","Text","The test material was first diluted in 70% ethanol and subsequently diluted 500-fold in cell culture medium. Another 2-fold dilution was executed in the well to obtain a total of 1000-fold dilution and a final solvent concentration of 0.07%. (ref: OHT201)"
"AnalyticalEndpoint1definition","Explain the method which helps to quantify the toxicological endpoint.","Mandatory","Text","If cell viability is the toxicological endpoint, then one of the analytical methods to assess cell viability is measuring LDH-release."
"AssayName","A defined laboratory procedure for qualitatively or quantitatively measuring the presence or amount or the functional activity of a target or analyte. An assay can be considered as a technical operation that consists of determination of one or more characteristics of a given product, process or service according to a specified procedure.<br><br>Ref: OECD (2018), Guidance Document on Good In Vitro Method Practices (GIVIMP).<br><br>Mention the assay name here (with branding details, if commercially procured). If the assay is described in a publication, provide the DOI.","Mandatory","Text, doi:","IL-2 Luc Assay,LDH Glo Cytotoxicity Assay"
"AssayKit","Name of the commercially procured assay kit used to perform the assay.","Conditionally required","Text","ATP Assay Kit, Pierce BCA Protein Assay Kit"
"AssayKitProvider","Name of the company which manufactures (markets/distributes) the assay kit, with as much details as possible","Recommended","Text","Cambridge Bioscience (manufacturer: Cell Biolabs, Inc.), Thermo Scientific (part of Thermo Fisher Scientific)"
"AssayKitCatalogueNumber","The catalogue/product number of the assay kit","Recommended","Text","MET-5163, 23227"
"AssayKitLotNumber","The lot/control number of the assay kit","Recommended","Text",NA
"AssayReagent1","If not using an assay kit, indicate the common name of the reagent used for the assay.<br><br>Reagent is a substance or mixture for use in cell culture media, chemical analysis or other reactions.","Conditionally required","Text",NA
"AssayReagent1Concentration","Concentration of the working reagent.<br><br>Definition: a solution that is prepared for immediate use in the analytical procedure, often by combining a stock solution (or multiple reagents) with a diluent.","Conditionally required","Numeric",NA
"AssayReagent1Unit","Unit of the concentration of the working assay reagent, preferably g/mL","Conditionally required","Text",NA
"BufferName","Common name of the buffer used in the experiment.","Conditionally required","Text",NA
"BufferConcentration","Concentration of the working solution of the buffer.","Conditionally required","Numeric",NA
"BufferConcentrationUnit","Unit of the concentration of the working buffer solution, preferably Molar concentrations.","Conditionally required","text",NA
"OECDTGD","Name and number of OECD Technical Guidance Document if followed for conducting the experiment.","Conditionally required","text","OECD Test Guideline number 471: Bacterial Reverse Mutation Test"
"OtherGD","Details of any other guidance document (i.e., non-OECD) being followed. Provide as much detail as possible.","Conditionally required","Text","ASTM E1439-12: Standard Guide for Conducting the Frog Embryo Teratogenesis Assay-Xenopus (FETAX)"
"Protocol","Title of the experimental protocol.If multiple protocols exist, please list them e.g. sample preparation protocol, sequencing protocol","Recommended","Text",NA
"ProtocolURL","The weblink of the Standard Operating Procedure. Initially MS-Teams link can be shared, once finalised can be uploaded to protocols.io (https://www.protocols.io/welcome-springernature)","Conditionally required","Text",NA
"ManufacturerInstrumentName","Name of the manufacturer followed by instrument name","Mandatory","Text","ThermoFisher Scientific - Varioskan ALF"
"TypeOfMeasurement","Detail the type of analytical measurement the instrument does","Mandatory","Text","spectrometry (nm), fluorometry (nm)"
"ReferenceItem","Reference items are substances with known activity, used as basis for comparison with the test material.<br><br>Ref: https://www.oecd.org/en/topics/assessment-of-chemicals/harmonised-templates-intermediate-effects.html<br><br>Detail the reference item, if used","Conditionally required","Text",NA
"PositiveControl","Common name of the compound that is used as a positive control in the assay. If positive control is not used, mention ‘not used’.<br><br>Definition: Separate part of the test system treated with an item for which it is known that the test system should respond. The positive control provides evidence that the test system is responsive under the actual conditions of the assay. The positive control is endpoint specific to the test system (ref: GIVIMP, Second Edition)","Mandatory","Text","Sodium Dodecyl Sulphate, Lipopolysaccharide"
"PositiveControlConcentration","The concentration of the compound used as a positive control","Conditionally required","Numeric",NA
"PositiveControlUnit","The measurement unit of concentration of the compound used as a positive control, in mM or mg/L","Conditionally required","Text",NA
"NegativeControlType","Definition: Separate part of a test system treated with an item for which it is known that the test system should not respond; the negative control provides evidence that the test system is not responsive under the actual conditions of the assay (ref: GIVIMP, Second Edition)<br><br>Solvent/vehicle control (consist of solvent or vehicle alone, without test item (test material), and otherwise treated in the same way as the treatment groups), untreated control (consist of culture medium without solvent / vehicle or test item and otherwise treated in the same way as the treatment groups), true negative control (items (e.g. chemicals) with known lack of activity). Ref: OECD 201<br><br>If any type of negative control is not used, mention ‘not used’","Mandatory","Text","Select from dropdown"
"NegativeControl","Describe the negative control.<br><br>.","Conditionally required","Text",NA
"NegativeControlConcentration","The concentration of the compound used as a negative control","Conditionally required","Numeric",NA
"NegativeControlUnit","The measurement unit of concentration of the compound used as a negative control, in mM or mg/L","Conditionally required","Text",NA
"NumberOfBiologicalReplicates","The number of biological replicates.<br><br>Biological replicates are parallel measurements of biologically distinct samples that capture random biological variation, which may itself be a subject of study or a noise source.<br><br>Ref: Blainey, P., Krzywinski, M., Altman, N., 2014. Replication. Nature Methods 11, 879–880. https://doi.org/10.1038/nmeth.3091","Recommended","Integer",NA
"NumberOfTechnicalReplicatesPerCondition","The number of technical replicates per concentration (single, duplicate, triplicate)<br><br>Technical replicates are repeated measurements of the same sample that represent independent measures of the random noise associated with protocols or equipment.<br><br>Ref: Blainey, P., Krzywinski, M., Altman, N., 2014. Replication. Nature Methods 11, 879–880. https://doi.org/10.1038/nmeth.3091","Recommended","Integer",NA
"DataAcquisition","The software/platform, if any, used for data acquisition","Conditionally required","Text","MassHunter Workstation (version B.07.00, Agilent);BD FACSDiva™ Software"
"RawDataProcessingSteps","The steps for processing raw data.<br><br>Data processing workflow can be created and submitted in https://workflowhub.eu","Mandatory","Text","Normalisation to negative/positive/vehicle control/ blank corrections, use of calibration curve, subtraction of control values, calculation of averages, standard deviations. Mention the statistical methods used to derive the parameters to be reported."
"SoftwareForDataProcessing","The name of the software (and version) for processing raw data.","Mandatory","Text","If a software is not used, mention “not used”<br><br>Microsoft® Excel® for Microsoft 365 MSO (Version 2512 Build 16.0.19530.20038) 64-bit, GraphPadPrism (GraphPad Software, La Jolla, CA, USA)"
"SoftwareSettingsForDataProcessing","Configuration and parameters defined within a software tool (other than Microsoft Excel) to analyse raw experimental data.","Conditionally required","Text","Format for raw data (fluorescence intensity, absorbance values, etc.) à thresholds/cutoff values for detecting significant changes à statistical tests à etc."
"OutlierHandling","Explanation of how outliers are handled, i.e., what (statistical) method has been used to exclude values.","Recommended","Text",NA
"SoftwareToDetermineEC50","Name of the software used to determine half maximal inhibition or effect concentration (if used)","Conditionally required","text","GraphPad Prism, ProTox-3.0"
"Researcher","The role a person has of being a researcher involved in a research investigation, for example by conducting experiments, collecting and analysing data, or undertaking formal study (ref: http://purl.org/spar/scoro/researcher)<br><br>In addition to credit and provenance, it helps in quality control and data tracking. Provide full name of the person, preferably as registered in ORCID registry, or name is scientific publications if any, or professional name most widely used.","Mandatory","text","Jane Doe"
"ResearcherORCID","ORCID ID of the person responsible for conducting the research and investigation process, specifically performing the experiments, or data/evidence collection, or the person who created the resource. In addition to credit and provenance, it helps in quality control and data tracking.","Mandatory","String/integer","0000-0002-6125-0555"
"DescriptionOfDataGeneration","Explain the datasets that would be generated from the studies<br><br>Dataset: Organised collection of data or objects in a computational format, that are generated or collected by researchers in the course of their investigations, regardless of their form or method, that form the object on which researchers test a hypothesis. This includes the full range of data: raw, unprocessed datasets, proprietary generated and processed data and secondary data obtained from third parties. Ref: https://terms.codata.org/rdmt/dataset<br><br>This question is also in PARC DSW Data Management Plan tool.","Mandatory","Text","Data related to relative (fold change) in hormone levels at each concentration, normalised metabolite ratio peak data per sample"
"SummaryDatafileReference","Name of the file which contains measured biological response results.","Recommended","String","Stringsummary.csv; stringsummary.xlsx"
"FileFormat","The format in which the file containing the data is available.<br><br>Refer to the following resources to detail the file format:<br><br>https://www.iana.org/assignments/media-types/media-types.xml<br><br>https://rdmkit.elixir-europe.org/data_organisation.html#:~:text=that%20generated%20it.-,Solutions,-The%20best%20file","Mandatory","String",NA
"Filestoragelocation","The location where the file is stored","Mandatory","String","University repository, Research Data Storage options provided by institutions, SharePoint, OneDrive."
